{
  "capability_policy_id": "cappol_625d80418e5113553b00",
  "created_at": "2026-06-09T00:00:00Z",
  "name": "local-default-capability-policy",
  "policy_sha256": "sha256:d265e5f6315a0c60a9cd42e6bfd7d9a874b96b77d01033e9f58c871d99fe35f7",
  "protected_path_rules": [
    {
      "actions": [
        "read",
        "write",
        "execute",
        "policy_change"
      ],
      "category": "secret",
      "decision": "deny",
      "patterns": [
        ".env",
        ".env.*",
        "**/.env",
        "**/.env.*",
        "**/*.pem",
        "**/*.key",
        "*.pem",
        "*.key",
        "*token*",
        "*secret*",
        "**/*token*",
        "**/*secret*",
        "**/secrets/**",
        ".ssh/**"
      ],
      "reason_code": "capability.secret_path_denied",
      "rule_id": "secrets-never-agent-readable-or-writable"
    },
    {
      "actions": [
        "read",
        "write",
        "execute",
        "policy_change"
      ],
      "category": "vcs_internal",
      "decision": "deny",
      "patterns": [
        ".git/**",
        ".git",
        ".gitmodules"
      ],
      "reason_code": "capability.vcs_internal_denied",
      "rule_id": "vcs-internals-denied"
    },
    {
      "actions": [
        "write",
        "policy_change"
      ],
      "category": "ams_authority",
      "decision": "defer",
      "patterns": [
        "ams/store.py",
        "ams/replay.py",
        "ams/replay_oracle.py",
        "ams/schema_validation.py",
        "ams/agent_memory_sim.py",
        "ams/real_agent_trial.py",
        "ams/work_mode_decision.py",
        "ams/doc_action_execution.py",
        "ams/doc_action_operator_approval.py",
        "ams/doc_action_patch_preview.py",
        "ams/doc_action_patch_readback.py",
        "ams/doc_action_patch_artifact.py",
        "ams/doc_action_patch_artifact_approval.py",
        "ams/doc_action_patch_dry_run.py",
        "ams/doc_action_patch_dry_run_readback.py",
        "ams/doc_action_patch_live_execution_approval.py",
        "ams/doc_action_patch_executor_preflight.py",
        "ams/doc_action_patch_apply_boundary.py",
        "ams/doc_action_patch_apply_acceptance.py",
        "ams/simulation_sweep.py",
        "ams/ams_emulation.py",
        "ams/semantic_oracle_review.py",
        "ams/semantic_hook_run.py",
        "ams/semantic_hook_install_plan.py",
        "ams/semantic_hook_approval.py",
        "ams/semantic_hook_target_snapshot.py",
        "ams/semantic_hook_install_transaction.py",
        "ams/semantic_hook_operator_approval.py",
        "ams/semantic_hook_operator_readback.py",
        "ams/attention_router.py",
        "ams/manager_intervention.py",
        "ams/intervention_delivery.py",
        "ams/intervention_settlement.py",
        "ams/architecture_audit.py",
        "ams/architecture_gate.py",
        "ams/rag_index_plan.py",
        "ams/artifact_quarantine.py",
        "ams/rag_embedding_job.py",
        "ams/rag_local_vector_trial.py",
        "ams/gate_adapter.py",
        "ams/resource_enforcement.py",
        "ams/resource_policy.py",
        "ams/shareability_bundle.py",
        "ams/shareability_receiver.py",
        "ams/capability_policy.py",
        "ams/definition_registry.py",
        "ams/package_manifest.py",
        "ams/runner_boundary.py",
        "ams/install_preflight.py",
        "ams/shadow_readiness.py",
        "ams/shadow_launch.py",
        "ams/shadow_runner.py",
        "ams/surface_bindings.py",
        "ams/surface_promise.py",
        "ams/cli.py",
        "schemas/*definition*.json",
        "schemas/*surface*.json",
        "schemas/*package*.json",
        "schemas/*policy*.json",
        "schemas/*verdict*.json",
        "schemas/manager_intervention.schema.json",
        "schemas/manager_intervention_delivery.schema.json",
        "schemas/manager_intervention_settlement.schema.json",
        "schemas/architecture_audit.schema.json",
        "schemas/architecture_gate_review.schema.json",
        "schemas/work_mode_decision.schema.json",
        "schemas/doc_action_execution_plan.schema.json",
        "schemas/doc_action_operator_approval_packet.schema.json",
        "schemas/doc_action_patch_preview.schema.json",
        "schemas/doc_action_patch_readback_receipt.schema.json",
        "schemas/doc_action_patch_artifact_receipt.schema.json",
        "schemas/doc_action_patch_artifact_approval_packet.schema.json",
        "schemas/doc_action_patch_dry_run_plan.schema.json",
        "schemas/doc_action_patch_dry_run_readback_receipt.schema.json",
        "schemas/doc_action_patch_live_execution_approval_packet.schema.json",
        "schemas/doc_action_patch_executor_preflight.schema.json",
        "schemas/doc_action_patch_apply_boundary_packet.schema.json",
        "schemas/doc_action_patch_apply_acceptance_packet.schema.json",
        "schemas/simulation_sweep.schema.json",
        "schemas/ams_emulation_trial.schema.json",
        "schemas/semantic_oracle_review.schema.json",
        "schemas/semantic_hook_record.schema.json",
        "schemas/semantic_hook_run.schema.json",
        "schemas/semantic_hook_install_plan.schema.json",
        "schemas/semantic_hook_approval_binding.schema.json",
        "schemas/semantic_hook_target_snapshot.schema.json",
        "schemas/semantic_hook_install_transaction.schema.json",
        "schemas/semantic_hook_operator_approval_packet.schema.json",
        "schemas/semantic_hook_operator_readback_receipt.schema.json",
        "schemas/rag_index_plan.schema.json",
        "schemas/downloaded_artifact_quarantine.schema.json",
        "schemas/rag_embedding_job.schema.json",
        "schemas/rag_local_vector_trial.schema.json",
        "schemas/resource_enforcement_trial.schema.json",
        "schemas/shareability_bundle.schema.json",
        "schemas/shareability_receiver_trial.schema.json",
        "examples/*definition*.json",
        "examples/*package*.json",
        "examples/*policy*.json",
        "data/*.json"
      ],
      "reason_code": "capability.ams_authority_requires_review",
      "rule_id": "ams-authority-requires-review"
    },
    {
      "actions": [
        "write",
        "execute",
        "policy_change"
      ],
      "category": "supply_chain",
      "decision": "defer",
      "patterns": [
        "pyproject.toml",
        "requirements*.txt",
        "uv.lock",
        "poetry.lock",
        "package.json",
        "package-lock.json",
        "pnpm-lock.yaml",
        "yarn.lock",
        ".github/**",
        "CODEOWNERS",
        ".pre-commit-config.yaml"
      ],
      "reason_code": "capability.supply_chain_requires_review",
      "rule_id": "supply-chain-requires-review"
    },
    {
      "actions": [
        "write",
        "execute",
        "policy_change"
      ],
      "category": "service_control",
      "decision": "defer",
      "patterns": [
        "*.plist",
        "launchd/**",
        "scripts/install*",
        "scripts/*daemon*"
      ],
      "reason_code": "capability.service_control_requires_review",
      "rule_id": "service-and-daemon-requires-review"
    }
  ],
  "review_requirements": {
    "live_mode_requires_signed_policy": true,
    "protected_change_requires": [
      "change_request_id",
      "admission_review_id",
      "signed_policy_sha256"
    ],
    "untrusted_repo_content_default": "read_or_patch_only"
  },
  "schema_version": "ams.ams.capability_policy.v0",
  "scope": {
    "default_egress": "deny",
    "workspace_roots": [
      "/home/user/ams"
    ]
  },
  "tiers": [
    {
      "allowed_actions": [
        "read"
      ],
      "allowed_egress_modes": [
        "none"
      ],
      "allowed_tools": [
        "Read",
        "ShellReadOnly"
      ],
      "denied_tools": [
        "Edit",
        "ApplyPatch",
        "network.post",
        "discord_client.send"
      ],
      "tier": "observer",
      "writable_globs": []
    },
    {
      "allowed_actions": [
        "read",
        "test"
      ],
      "allowed_egress_modes": [
        "none"
      ],
      "allowed_tools": [
        "Read",
        "ShellReadOnly",
        "Tests"
      ],
      "denied_tools": [
        "Edit",
        "ApplyPatch",
        "network.post",
        "discord_client.send"
      ],
      "tier": "verifier",
      "writable_globs": []
    },
    {
      "allowed_actions": [
        "read",
        "write",
        "test"
      ],
      "allowed_egress_modes": [
        "none",
        "ams_outbox"
      ],
      "allowed_tools": [
        "Read",
        "Edit",
        "ApplyPatch",
        "ShellReadOnly",
        "Tests"
      ],
      "denied_tools": [
        "network.post",
        "discord_client.send",
        "launchd.write",
        "git.push"
      ],
      "tier": "builder",
      "writable_globs": [
        "README.md",
        "MAP.md",
        "MILESTONES.md",
        "STATUS.md",
        "NEW_CODEX_SESSION.md",
        "*.md",
        "notes/**",
        "tests/**",
        "examples/*.json",
        "schemas/*.schema.json",
        "ams/*.py"
      ]
    },
    {
      "allowed_actions": [
        "read",
        "write",
        "test",
        "policy_change"
      ],
      "allowed_egress_modes": [
        "none",
        "ams_outbox"
      ],
      "allowed_tools": [
        "Read",
        "Edit",
        "ApplyPatch",
        "ShellReadOnly",
        "Tests"
      ],
      "denied_tools": [
        "network.post",
        "discord_client.send",
        "launchd.write",
        "git.push"
      ],
      "tier": "maintainer",
      "writable_globs": [
        "*"
      ]
    },
    {
      "allowed_actions": [
        "read",
        "write",
        "test",
        "policy_change",
        "egress"
      ],
      "allowed_egress_modes": [
        "none",
        "ams_outbox"
      ],
      "allowed_tools": [
        "Read",
        "Edit",
        "ApplyPatch",
        "ShellReadOnly",
        "Tests",
        "EgressOutbox"
      ],
      "denied_tools": [